{
  "$schema": "http://json-schema.org/draft-07/schema#",
  "$id": "https://internal/schemas/redis-onboarding-request.json",
  "title": "Azure Managed Redis Onboarding Request",
  "description": "Schema for one onboarding request file consumed by the Terraform root under config/onboarding-files-redis/*.json. This is the exact shape the UI/wrapper API must produce — every field name, nesting level, and allowed value here is read verbatim by locals.tf. Fields not listed here are ignored by Terraform even if present. This file is a reference for the UI team, not itself read by Terraform.",
  "type": "object",
  "required": ["request_type", "environment", "requested_by", "instance"],
  "properties": {
    "type": {
      "type": "string",
      "const": "instance",
      "description": "Structural marker. Always the literal string \"instance\". Not used by Terraform (filtered by filename, not this field), but keep it for consistency with default.json's own \"type\" marker."
    },
    "request_type": {
      "type": "string",
      "enum": ["create", "delete"],
      "description": "\"create\" covers BOTH creating a new instance and updating an existing one — there is no separate \"update\" value. To change an existing instance, resubmit the same file with the same instance.name and the changed field(s). \"delete\" removes the instance from the next Terraform apply; the instance object can be left in place as a historical record."
    },
    "environment": {
      "type": "string",
      "enum": ["dev", "qa", "uat", "prod"],
      "description": "Which environment this request applies to. Must match one of default.json's environments.<env> keys exactly. Determines subscription_id, resource group, default location, and VNet/subnet — and also becomes this instance's `environment` Azure tag automatically (the UI does not need a separate field for that tag)."
    },
    "requested_by": {
      "type": "string",
      "description": "Free-text requester identity (e.g. team name, username). Not validated or used by Terraform beyond being stored in the request file; purely a paper trail.",
      "examples": ["platform-team", "jane.doe@example.com"]
    },
    "instance": {
      "$ref": "#/$defs/instance"
    }
  },

  "$defs": {
    "instance": {
      "type": "object",
      "required": ["name"],
      "properties": {

        "name": {
          "type": "string",
          "pattern": "^[a-z][a-z0-9-]{0,55}[a-z0-9]$",
          "description": "Base name for the instance. Terraform appends \"-<environment>\" automatically to build the real Azure resource name (e.g. \"my-cache\" + dev -> \"my-cache-dev\") — do NOT include the environment in this field. MUST be unique across every request file targeting the same environment; two files with the same name silently collide and only one instance gets created (this template's request_names_unique_per_environment check catches this at plan time). Keep it short.",
          "examples": ["my-cache", "checkout-session-cache"]
        },

        "location": {
          "type": "string",
          "description": "Azure region for the PRIMARY instance, e.g. \"eastus2\". Optional — omit to use the environment's default location (default.json.environments.<env>.location). Any Azure region is accepted as-is (this template maintains no allow-list). Only matters for DR: cross-region replication is currently only supported between the specific pairs listed in default.json.dr_region_pairs (see deployment_topology below) — requesting DR-ActivePassive/DR-ActiveActive from a primary location outside a supported pair fails plan-time validation.",
          "default": "<environment's default location from default.json>",
          "examples": ["eastus2", "centralus"]
        },

        "deployment_topology": {
          "type": "string",
          "enum": ["STANDALONE", "HA", "DR-ActivePassive", "DR-ActiveActive"],
          "default": "STANDALONE",
          "description": "The single topology knob — there is no separate replica_count or cross_region_replica field the way some other onboarding flows split this into. STANDALONE: no HA, no DR. HA: HA/zone redundancy enabled, single region. DR-ActivePassive: adds a standalone standby DR instance in the paired region (kept in sync out-of-band — see the redis module's README). DR-ActiveActive: adds a DR instance live-linked via geo-replication; persistence is automatically disabled in this mode regardless of the persistence block below."
        },

        "node_type": {
          "type": "string",
          "enum": [
            "Enterprise_E1", "Enterprise_E5", "Enterprise_E10", "Enterprise_E20",
            "Enterprise_E50", "Enterprise_E100", "Enterprise_E200", "Enterprise_E400",
            "EnterpriseFlash_F300", "EnterpriseFlash_F700", "EnterpriseFlash_F1500",
            "Balanced_B0", "Balanced_B1", "Balanced_B3", "Balanced_B5", "Balanced_B10",
            "Balanced_B20", "Balanced_B50", "Balanced_B100", "Balanced_B150",
            "Balanced_B250", "Balanced_B350", "Balanced_B500", "Balanced_B700", "Balanced_B1000",
            "MemoryOptimized_M10", "MemoryOptimized_M20", "MemoryOptimized_M50",
            "MemoryOptimized_M100", "MemoryOptimized_M150", "MemoryOptimized_M250",
            "MemoryOptimized_M350", "MemoryOptimized_M500", "MemoryOptimized_M700",
            "MemoryOptimized_M1000", "MemoryOptimized_M1500", "MemoryOptimized_M2000",
            "ComputeOptimized_X3", "ComputeOptimized_X5", "ComputeOptimized_X10",
            "ComputeOptimized_X20", "ComputeOptimized_X50", "ComputeOptimized_X100",
            "ComputeOptimized_X150", "ComputeOptimized_X250", "ComputeOptimized_X350",
            "ComputeOptimized_X500", "ComputeOptimized_X700",
            "FlashOptimized_A250", "FlashOptimized_A500", "FlashOptimized_A700",
            "FlashOptimized_A1000", "FlashOptimized_A1500", "FlashOptimized_A2000", "FlashOptimized_A4500"
          ],
          "description": "Azure Managed Redis SKU. Please select one of the Balanced_Bxx options unless advised by engineering or Redis support. Changing this on an existing instance forces replacement (Azure API behavior).",
          "x-notes": "No fixed default here — the UI should require an explicit choice, or default.json.node_type (\"Balanced_B0\") is used if omitted."
        },

        "authorization_mode": {
          "type": "string",
          "enum": ["AccessKey", "MicrosoftEntraID"],
          "default": "AccessKey",
          "description": "Client authentication mode. AccessKey is fully self-service — works end to end through this onboarding flow. MicrosoftEntraID disables access-key auth, but requires the platform team to grant specific principals data-plane access OUT OF BAND (Azure Portal/CLI) after this request applies — no Terraform automation exists for that grant yet. Do not let a UI submit MicrosoftEntraID without surfacing that manual follow-up step to the requester."
        },

        "persistence": {
          "type": "object",
          "description": "All sub-fields are optional and merged individually against default.json's persistence block — you can set just `mode` and still inherit the matching rdb/aof frequency default. Automatically forced to DISABLED (regardless of what's requested here) whenever deployment_topology = DR-ActiveActive.",
          "properties": {
            "mode": {
              "type": "string",
              "enum": ["RDB", "AOF", "DISABLED"],
              "default": "DISABLED"
            },
            "rdb_frequency": {
              "type": "string",
              "enum": ["1h", "6h", "12h"],
              "default": "12h",
              "description": "Only meaningful when mode = RDB."
            },
            "aof_frequency": {
              "type": "string",
              "enum": ["always", "1s"],
              "default": "1s",
              "description": "Only meaningful when mode = AOF."
            }
          }
        },

        "eviction_policy": {
          "type": "string",
          "enum": ["AllKeysLRU", "AllKeysLFU", "AllKeysRandom", "VolatileLRU", "VolatileLFU", "VolatileRandom", "VolatileTTL", "NoEviction"],
          "default": "AllKeysLRU"
        },

        "deletion_protection_enabled": {
          "type": "boolean",
          "default": true,
          "description": "When true, an Azure resource lock (CanNotDelete) is created on the instance — deletion is blocked at the Azure Portal/CLI/API level, not just a Terraform-side guard. Must be explicitly set back to false in a prior apply before a delete request can succeed. Also blocks any change that forces resource replacement (e.g. node_type) until temporarily disabled."
        },

        "geo_replication_group_name": {
          "type": "string",
          "description": "Optional name override for the geo-replication group. Only relevant when deployment_topology = DR-ActiveActive; ignored otherwise. Leave unset to let Azure generate one.",
          "x-notes": "Present in the schema for completeness; most requests should omit this."
        },

        "application_id": {
          "type": "string",
          "description": "Instance-level field (NOT nested under `tags`). Always becomes the `application_id` Azure tag. Optional — falls back to default.json's `default_application_id` if omitted.",
          "examples": ["platform-demo", "checkout-service"]
        },
        "lob": {
          "type": "string",
          "description": "Instance-level field (NOT nested under `tags`). Always becomes the `lob` (line of business / cost center) Azure tag if provided. No default — omitted entirely from tags if not set.",
          "examples": ["cc-0001"]
        },
        "tags": {
          "type": "object",
          "additionalProperties": { "type": "string" },
          "description": "OPTIONAL free-form extra tags, entirely at the requester's discretion — anything set here is appended to the instance's Azure tags alongside application_id/lob. Most requests can omit this entirely. Do NOT put `topology`, `environment`, or `managed_by` in here — those three keys are always overwritten by Terraform-derived values regardless of what's sent, so a UI should either omit them as options or grey them out.",
          "examples": [{ "criticality": "high" }, { "pod": "team-alpha", "cost-optimization": "enabled" }]
        },

        "client_protocol": {
          "description": "NOT a request field. Every instance is created with client_protocol = Encrypted — enforced by the Terraform module itself (validation rejects any other value); there is no override. Do not expose this as a UI field.",
          "x-not-settable": true
        },
        "public_network_access": {
          "description": "NOT a request field. Every instance is created with public_network_access = Disabled — enforced by the Terraform module itself; there is no override. Do not expose this as a UI field.",
          "x-not-settable": true
        }
      }
    }
  },

  "x-fields-never-in-request": {
    "description": "These are computed entirely by Terraform and must never be exposed as UI inputs, even read-only ones that echo a value back — showing them invites someone to eventually try to set them.",
    "fields": [
      "resource_group_name / subnet_name / vnet_name / vnet_resource_group_name / dr_subnet_name / dr_vnet_name / dr_vnet_resource_group_name (always environment infra from default.json, never instance-settable)",
      "dr_location (derived from location via dr_region_pairs, only when deployment_topology is one of the DR-* values)",
      "tags.topology / tags.environment / tags.managed_by (always overwritten by Terraform even if present in tags)",
      "client_protocol / public_network_access (hard-fixed by the Terraform module to Encrypted / Disabled)"
    ]
  }
}
