{
  "type": "instance",
  "request_type": "create",
  "environment": "dev",
  "requested_by": "platform-team",
  "instance": {
    "name": "test-standalone-cache",
    "deployment_topology": "STANDALONE",
    "node_type": "Balanced_B0",
    "application_id": "platform-demo",
    "lob": "cfes",
    "deletion_protection_enabled": false
  }
}