{
  "type": "instance",
  "request_type": "create",
  "environment": "dev",
  "requested_by": "platform-team",
  "instance": {
    "name": "test-dr-ap-cache",
    "deployment_topology": "DR-ActivePassive",
    "node_type": "Balanced_B0",
    "application_id": "platform-demo",
    "lob": "cc-0003",
    "tags": {
      "criticality": "high"
    },
    "deletion_protection_enabled": false
  }
}
